{
  "$schema": "https://json-schema.org/draft/2020-12/schema",
  "$id": "https://openape.org/schemas/grant.json",
  "title": "OpenApe Grant",
  "description": "A grant representing a permission request and its lifecycle state.",
  "type": "object",
  "properties": {
    "id": {
      "type": "string",
      "format": "uuid",
      "description": "Unique grant identifier (UUID v4)."
    },
    "type": {
      "type": "string",
      "enum": ["command", "delegation", "standing"],
      "default": "command",
      "description": "Grant category."
    },
    "request": {
      "$ref": "grant-request.json",
      "description": "The grant request details."
    },
    "status": {
      "type": "string",
      "enum": ["pending", "approved", "denied", "revoked", "expired", "used", "withdrawn"],
      "description": "Current grant status."
    },
    "decided_by": {
      "type": "string",
      "description": "Identifier of the user who approved or denied the grant."
    },
    "created_at": {
      "type": "number",
      "description": "Unix timestamp (seconds) when the grant was created."
    },
    "decided_at": {
      "type": "number",
      "description": "Unix timestamp (seconds) when the decision was made."
    },
    "expires_at": {
      "type": "number",
      "description": "Unix timestamp (seconds) when the grant expires."
    },
    "withdraw_reason": {
      "type": "string",
      "minLength": 1,
      "maxLength": 500,
      "allOf": [
        { "pattern": "\\S" },
        { "not": { "pattern": "[\\p{Cc}\\p{Cf}\\p{Zl}\\p{Zp}]" } }
      ],
      "description": "Requester's optional reason when it withdrew its own referenced request (status withdrawn)."
    },
    "used_at": {
      "type": "number",
      "description": "Unix timestamp (seconds) when the grant was consumed."
    },
    "brokered": {
      "type": "object",
      "properties": {
        "connection_id": {
          "type": "string",
          "format": "uuid"
        },
        "broker_issuer": {
          "type": "string",
          "format": "uri"
        },
        "agent_issuer": {
          "type": "string",
          "format": "uri"
        },
        "owner": {
          "type": "string"
        },
        "key_id": {
          "type": "string",
          "minLength": 1
        }
      },
      "required": [
        "connection_id",
        "broker_issuer",
        "agent_issuer",
        "owner",
        "key_id"
      ],
      "additionalProperties": false
    }
  },
  "required": ["id", "request", "status", "created_at"],
  "additionalProperties": false
}
